Event H-ID,Start page event,End page event,Page Event Number,Line,Narrative Status,Conflict,Harmony,Religious Syncretism,Partition,Location of Event (Text place) H-ID,Location of Event RecordTitle,Character(s) mentioned H-ID,Character(s) mentioned RecordTitle
126,12,12,1,"Juggut Singh stretched out his hands over his head and behind him, groping;",,,,,,128,Sutlej River in Train to Pakistan,,
135,137,137,1,"'We want numbers, only numbers! Why don't you understand?",,,,,TRUE,137,Relief Committee Office in Tamas,,
138,137,137,2,"But Kartar Singh, seated across the table from him",,Religion,,,TRUE,137,Relief Committee Office in Tamas,,
140,137,138,3,'Name?' 'Harnam Singh.' 'Father's name?' 'Sardar Gur Dayal Singh',,,,,TRUE,137,Relief Committee Office in Tamas,,
142,138,139,1,"'Oh, Babu ji, who knows if my Sukhwant really jumped into",,,,,TRUE,137,Relief Committee Office in Tamas,,
144,139,140,1,Statistics Babu was still standing on the balcony when,,Interpersonal,,,TRUE,137,Relief Committee Office in Tamas,,
145,140,140,1,"The evening before, Dev Dutt had come by",,,,,TRUE,137,Relief Committee Office in Tamas,,
157,76,76,2,The grain market still burned,,,,,,195,Grain Market in Tamas,,
165,27,28,1,The two of them halted their horses,,,,,,176,Top of hill (Alexander valley) in Tamas,,
171,41,41,1,Vanaprasthi began to read the usual mantras,,,,,,200,Congregation in Tamas,,
201,76,76,1,"In the light of day, the city lay still",,,,,,211,THE CITY in Tamas,,
215,76,76,3,"A few milk shops were open here and there, and groups of men stood nearby",,,,,,198,Milk Shops in Tamas,,
226,41,41,2,One could get a taste of Indian culture,,,,,,200,Congregation in Tamas,,
232,30,30,1,Richard and Liza walked through the bungalow’s many rooms,,,,,,235,Richard & Liza's bungalow in Tamas,,
239,31,31,1,"Before sitting down to eat breakfast, Richard stopped",,,,,,235,Richard & Liza's bungalow in Tamas,,
314,156,156,1,THE day after the reception the Viceroy was,,,,,,370,"Lucknow, India in Sunlight on a Broken Column",,
322,1,1,1,The day my Aunt Abida moved from the zenana into the guest room,,,,,,65,Zenana in Sunlight on a Broken Column,,
328,18,18,1,Through the curtained door of the guest room came the sound of voices in argument,,,,,,65,Zenana in Sunlight on a Broken Column,,
333,13,13,1,He had robbed her of her birthright,,Religion,,,,334,Rashida's home in Pinjar,2434|2440,"Sahukar, Pooro's Mother in Pinjar|Sahukar, Pooro's Father in Pinjar"
335,14,14,1,At night she stole the key of the door,,Religion,,,FALSE,334,Rashida's home in Pinjar,297,"Shaikh, Rashida in Pinjar"
336,14,14,2,unlocked the door and stepped out of her prison.,,,,,,334,Rashida's home in Pinjar,,
337,14,14,3,Pooro rattled the chain.,,Religion,,,,338,"Pooro's home, Chatto village in Pinjar",2440|2434,"Sahukar, Pooro's Father in Pinjar|Sahukar, Pooro's Mother in Pinjar"
339,15,15,1,Rashida came running breathlessly towards her.,,,,,,338,"Pooro's home, Chatto village in Pinjar",,
342,15,15,1,Rashida came running breathlessly towards her.,,,,,,338,"Pooro's home, Chatto village in Pinjar",,
345,15,15,2,The third day the Maulvi came with another two or three men.,,,,,,334,Rashida's home in Pinjar,,
346,26,28,1,They were all staring at a smaller group in the foreground.,,,,,,1991,House in Sunlight on a Broken Column,,
350,16,16,1,Rashida packed is odds and ends,,,,,FALSE,334,Rashida's home in Pinjar,,
357,16,16,2,They did not pester her with many questions,,,,,,355,Sakkar village in Pinjar,,
358,16,16,3,The man tattooed on it the new name,,,,,,355,Sakkar village in Pinjar,,
360,17,17,1,He lit the fire in the hearth and put,,,,,,355,Sakkar village in Pinjar,,
361,18,19,1,"it was animated crowd, with groups moving",,,,,,355,Sakkar village in Pinjar,,
365,20,21,1,Rashida sent for Rahima’s mother.,,,,,,355,Sakkar village in Pinjar,,
372,21,21,2,Rashida heard Hamida shriek thrice; then the crying,,,,,,355,Sakkar village in Pinjar,,
385,21,22,2,Rashida was overcome with emotion. He had won over the Hindu girl.,,Religion,,,TRUE,334,Rashida's home in Pinjar,445,"Shaikh, Javed in Pinjar"
387,21,21,3,"One full hour later, the midwife came out and said",,,,,FALSE,334,Rashida's home in Pinjar,,
389,22,22,2,Hamida opened her eyes. They seemed to say,,Interpersonal,,,FALSE,334,Rashida's home in Pinjar,,
390,22,22,3,"A strange, strong emotion welled up in Hamida’s bosom.",,Interpersonal,Interpersonal,,FALSE,334,Rashida's home in Pinjar,,
391,22,23,1,The boy tugged at his mother’s breast.,,Interpersonal,Interpersonal,,FALSE,334,Rashida's home in Pinjar,,
396,23,23,2,One morning Hamida went out to the fields,,,,,FALSE,2824,Field in Pinjar,,
398,23,23,3,she came to the well used by the Muslims,,,Religion,,FALSE,397,Well in Pinjar,,
401,23,23,4,"she recognized the girl, Kammo, who lived",,,,,FALSE,397,Well in Pinjar,,
402,23,24,1,Hamida went up to Kammo,,,Gender,,FALSE,397,Well in Pinjar,,
403,24,25,1,"“I can carry the pitcher for you,” said Hamida",,,Gender,,FALSE,2824,Field in Pinjar,,
404,156,156,2,On the day of the Viceroy's arrival the,,,,,,370,"Lucknow, India in Sunlight on a Broken Column",,
407,104,104,1,After the ritual ceremonies on the third day,,,,,,1991,House in Sunlight on a Broken Column,,
411,156,156,3,All morning my uncle was kept busy with,,,,,,370,"Lucknow, India in Sunlight on a Broken Column",,
419,157,158,1,Everything had gone well. Speeches had been made;,,,,,,427,University in Sunlight on a Broken Column,,
420,105,105,1,"""Whatever I am told to. Laila, don't look so solemn",,,,,,1991,House in Sunlight on a Broken Column,,
425,106,106,1,During the rainy season we used to hang,,,,,,1991,House in Sunlight on a Broken Column,,
430,158,159,1,Nita was explosive when we met to discuss,,,,,,427,University in Sunlight on a Broken Column,,
437,25,25,2,Kammo fell on a heap of rubble,,,,,FALSE,2824,Field in Pinjar,,
438,25,25,3,Kammo’s father had taken another woman,,Interpersonal,,,FALSE,355,Sakkar village in Pinjar,,
447,25,25,3,door was pushed open and Kammo burst in,,,,,FALSE,334,Rashida's home in Pinjar,,
449,25,25,4,Hamida again massaged Kammo’s foot,,,Interpersonal,,FALSE,334,Rashida's home in Pinjar,,
450,26,27,1,One early morning Kammo came while,,,,,FALSE,334,Rashida's home in Pinjar,,
451,27,27,2,“My aunt says that if I come to,,Religion,,,TRUE,334,Rashida's home in Pinjar,,
457,27,27,3,Occasionally Hamida called on Rahima’s two wives,,,Interpersonal,,FALSE,458,Rahima's house in Pinjar,,
459,27,28,1,"drawn towards a young, sallow-faced girl",,,Interpersonal,,FALSE,355,Sakkar village in Pinjar,,
460,28,28,2,Then Hamida sent some yarn to the girl’s mother,,,Interpersonal,,FALSE,355,Sakkar village in Pinjar,,
463,28,28,3,Hamida sat down beside her,,,Interpersonal,,FALSE,355,Sakkar village in Pinjar,,
473,29,30,1,When Zahra came to tell me that Aunt Abida had sent for me,,,,,,1991,House in Sunlight on a Broken Column,,
479,30,33,2,In Baba Jan's room the light was blended with shadows,,,,,,1991,House in Sunlight on a Broken Column,,
489,36,38,1,Since Aunt Abida had moved from the zenana,,,,,,1991,House in Sunlight on a Broken Column,,
490,38,42,1,I did not go to my room to pray but to Hakiman Bua,,,,,,1991,House in Sunlight on a Broken Column,,
499,30,31,1,Hamida began to press the girl’s limbs and,,Interpersonal,,,,355,Sakkar village in Pinjar,,
500,31,31,1,Taro had a second ﬁt. Her ﬁsts were,,Religion,,,,355,Sakkar village in Pinjar,,
506,32,32,1,The two played hide-and-seek in the evenings,,,,,,355,Sakkar village in Pinjar,,
511,32,32,2,One day a woman came to their,,,,,,355,Sakkar village in Pinjar,,
512,32,33,3,Suddenly a woman came running down the street,,,,,,355,Sakkar village in Pinjar,,
513,33,33,1,"Before anything could be done to prevent her,",,Interpersonal,,,,355,Sakkar village in Pinjar,,
517,34,34,1,One evening the elders of the Panchayat took,,Interpersonal,,,,355,Sakkar village in Pinjar,,
520,35,35,1,"In the early hours of the morning, while it was still dark,",,,Interpersonal,,,355,Sakkar village in Pinjar,,
522,35,35,2,The news spread in the village like the morning mist.,,,Religion,,,355,Sakkar village in Pinjar,,
523,36,36,1,The women came and blessed Hamida,,,Religion,,,355,Sakkar village in Pinjar,,
524,36,36,2,In the evening Rashida cleansed the glass,,,,,,334,Rashida's home in Pinjar,,
525,36,37,3,Hamida woke up with a start. Her new baby,,,,,,334,Rashida's home in Pinjar,,
526,37,39,1,The Hindus called a meeting to discuss the matter.,,Religion,,,,355,Sakkar village in Pinjar,,
530,40,40,1,One day the Hindu elders of the village sent for Rashida.,,Interpersonal,,,,334,Rashida's home in Pinjar,,
533,40,40,2,A group of Hindu elders lay sprawling on charpoys laid out in a courtyard,,,,,,355,Sakkar village in Pinjar,,
535,41,41,1,My wife has nourished him up with infinite care for six months,,Religion,,,,355,Sakkar village in Pinjar,,
536,42,42,1,The Hindu elders stood up to indicate that the argument was at an end,,Religion,,,,334,Rashida's home in Pinjar,,
538,42,43,2,The water-carrier’s wife took the foundling from Hamida’s arms,,Religion,Interpersonal,,,334,Rashida's home in Pinjar,,
539,43,43,1,the villages could talk of nothing but the fate of the foundling,,,,,,355,Sakkar village in Pinjar,,
541,43,43,2,Hamida beat her head against the wall and shed bitter tears,,,,,,334,Rashida's home in Pinjar,,
542,44,44,1,The next morning three men,,Religion,,,,334,Rashida's home in Pinjar,,
544,45,45,1,A week later the villager saw the foundling,,Religion,,,,334,Rashida's home in Pinjar,,
545,45,45,2,Rahima’s old mother was gradually losing,,,,,,355,Sakkar village in Pinjar,,
548,45,45,3,One day Rahima’s mother came,,Interpersonal,,,,355,Sakkar village in Pinjar,,
549,46,46,1,The name Rattoval pierced through,,,,,,355,Sakkar village in Pinjar,,
550,46,46,2,Rashida did not object to his wife’s,,Interpersonal,,,,355,Sakkar village in Pinjar,,
552,46,46,3,The servant and the child took,,,,,,355,Sakkar village in Pinjar,,
554,47,47,1,The sound of pipes and drums came to her ears and all at once the palanquin,,,,,,559,Rattoval in Pinjar,,
560,48,48,1,The servant arranged the baggage,,,,,,559,Rattoval in Pinjar,,
562,48,48,2,The Holy One told Rahima’s Mother that her treatment would take thirteen days,,Interpersonal,,,,559,Rattoval in Pinjar,,
563,49,49,1,She left the boy in the care of,,Interpersonal,,,,559,Rattoval in Pinjar,,
564,49,49,2,Hamida could not hold back her tears,,Interpersonal,,,,559,Rattoval in Pinjar,,
565,49,49,3,Ram Chand looked worried and glanced,,,,,,559,Rattoval in Pinjar,,
611,50,50,1,The servant had come back from Sakkar,,,,,FALSE,559,Rattoval in Pinjar,,
621,50,50,2,Hamida could not sleep that night,,,,,FALSE,559,Rattoval in Pinjar,,
627,50,50,3,Hamida rose from her charpoy,,,,,FALSE,559,Rattoval in Pinjar,,
631,50,50,4,Her palms were still on her eyes when,,,Religion,,FALSE,559,Rattoval in Pinjar,,
634,50,50,5,She withdrew her hands from,,,,,FALSE,559,Rattoval in Pinjar,,
636,50,50,6,She went away without turning to look back,,Interpersonal,,,FALSE,559,Rattoval in Pinjar,,
637,51,51,1,One evening Rashida came home with his face drawn,,,,,FALSE,355,Sakkar village in Pinjar,,
638,51,51,2,"He fondled the little one, as he always did",,,,,FALSE,355,Sakkar village in Pinjar,,
842,51,51,3,He spoke without her prompting,,,,,FALSE,355,Sakkar village in Pinjar,,
843,51,51,4,Someone set fire to the stacks at night,,Interpersonal,,,FALSE,355,Sakkar village in Pinjar,,
845,76,76,4,"All the same, early that morning, as usual",,,,,,612,Congress Committee Office in Tamas,,
846,52,52,1,"The children were fast asleep, but no sleep came",,,,,FALSE,355,Sakkar village in Pinjar,258,"Sahukars, Unknown 2 in Pinjar"
847,52,52,2,He turned restlessly from one side to another,,,,,FALSE,355,Sakkar village in Pinjar,,
848,52,52,3,Rashida continued to toss as restlessly as before,,,,,FALSE,355,Sakkar village in Pinjar,,
849,52,52,4,She got up and sat beside her husband,,,,,FALSE,355,Sakkar village in Pinjar,,
853,52,52,5,I am told that a young stranger came,,,,,FALSE,355,Sakkar village in Pinjar,258,"Sahukars, Unknown 2 in Pinjar"
855,76,76,5,Ranvir had not returned home the night before,,,,,,856,Ranvir's home in Tamas,,
857,52,52,6,The only other information Rashida gave her,,,,,FALSE,355,Sakkar village in Pinjar,,
858,76,76,6,Master Dev Vrat had managed to send a message,,,,,,211,THE CITY in Tamas,,
942,254,254,2,And Ghulam Ali attacked Nandi as she stood laughing,,,,,,943,street in Sunlight on a Broken Column,,
944,255,255,1,the day of Uncle Hamid's election came at last,,,,,,1991,House in Sunlight on a Broken Column,321|910,"Hasan, Hamid in Sunlight on a Broken Column|Hasan, Kemal in Sunlight on a Broken Column"
972,35,35,1,Darkness was beginning to fade by the time,,,,,,817,Imam Din Mohalla in Tamas,,
973,35,35,2,Holding his head high and lifting the tricolour,,,,,,817,Imam Din Mohalla in Tamas,,
975,36,36,1,Mehta and Master Ram Das took the trays and went towards the courtyard,,,,,,817,Imam Din Mohalla in Tamas,,
976,36,36,2,"Hey there, you—kind sir—what’s this crime you’re committing",,,,,,817,Imam Din Mohalla in Tamas,,
977,37,37,1,Have you come to burden us with gratitude,,,Religion,,,817,Imam Din Mohalla in Tamas,,
979,37,37,2,"‘I’m doing it! I’m doing the community work, aren’t I",,,,,,817,Imam Din Mohalla in Tamas,,
981,37,37,3,"Right at that moment, a man came running from the direction of the Committee Park",,,,,,817,Imam Din Mohalla in Tamas,,
986,38,38,1,"Please, gentlemen, get away from here. If you know what’s best for you, leave right away.",,Religion,,,,817,Imam Din Mohalla in Tamas,,
989,38,38,2,"Just then, a stone came flying through the air and fell near Bakhshi",,Religion,,,,817,Imam Din Mohalla in Tamas,,
990,38,38,3,The Congress group set out quietly,,,,,,817,Imam Din Mohalla in Tamas,,
991,39,39,1,When they turned into the gali of the Mohyals,,,,,,838,Gali of the Mohyals in Tamas,,
992,39,39,2,Look at the steps leading up to the door of the mosque,,Religion,,,,837,Kelon ka Masjid in Tamas,,
993,39,39,4,A Muslim passed quickly by on the street and the moment,,,,,,837,Kelon ka Masjid in Tamas,,
994,39,39,5,Let’s get that pig carcass out of here,,,Religion,,,837,Kelon ka Masjid in Tamas,,
995,40,40,1,It was a black pig. Someone had covered it with a sack,,,,,,837,Kelon ka Masjid in Tamas,,
996,40,40,2,Then came the sound of running footsteps from the direction of the well,,,,,,837,Kelon ka Masjid in Tamas,,
1021,140,141,2,Some Congress workers were sitting on the platform,,,,,TRUE,137,Relief Committee Office in Tamas,628,"Congress Committee Member (part of singing group), The General in Tamas"
1022,141,141,1,A group of ten or eleven men was joking,,,,,FALSE,137,Relief Committee Office in Tamas,,
1024,141,142,2,Across the veranda to one side of the courtyard,,Religion|Caste,,,TRUE,632,Arya School in Tamas,,
1028,142,142,1,Allah Rakha had indeed taken Prakasho home,,Religion,,,TRUE,1033,Bottom of hill in Tamas,,
1034,142,143,2,"Just then, Allah Rakha came in, and sitting down",,,Religion|Gender|Caste,,TRUE,1035,Allah Rakha's home in Tamas,1026,"Chaprasi's Pandit's wife, Unknown in Tamas"
1090,13,13,1,"He slumped on the floor, his back resting against the wall",,,,,,604,Nathu's Hut in Tamas,,
1091,13,13,2,He had heard somewhere that if you want to kill a pig,,,,,,604,Nathu's Hut in Tamas,229,"Nathu's friend, Bhikhru Chamar in Tamas"
1092,13,14,3,Our Vet Sahib needs a dead pig for his work,,,,,,604,Nathu's Hut in Tamas,227|605,"Asked for the dead pig, Vet Sahib in Tamas|Sweeper, Unknown in Tamas"
1100,14,15,1,Getting the pig into the hut was hardly easy,,,,,,604,Nathu's Hut in Tamas,219|605,"Committee Manager, Servant to Vet Sahib, Murad Ali in Tamas|Sweeper, Unknown in Tamas"
1102,15,16,1,What have I gotten myself into,,,,,,1106,Yard outside Nathu's Hut in Tamas,219|605|609|608,"Committee Manager, Servant to Vet Sahib, Murad Ali in Tamas|Sweeper, Unknown in Tamas|From the piggery, Purbia in Tamas|Nathu's wife, Unknown in Tamas"
1107,16,17,1,He approached the hut with trepidation,,,,,,604,Nathu's Hut in Tamas,,
1118,17,19,1,The clock at Sheikh's Garden struck four.,,,,,,612,Congress Committee Office in Tamas,614|615|951|146|624|620,"Member of Secret Police 1, Unknown in Tamas|Member of Secret Police 2, Unknown in Tamas|Congress Committee Member, Jawaharlal Nehru in Tamas|Dutt, Dev in Tamas|Congress Committee Member (part of singing group), Desraj in Tamas|Congress Committee Member (part of singing group), Master Ramdas in Tamas"
1121,19,20,1,"But after they returned from Lahore, Shankar truly did get back at Mehta",,,,,,1127,Scrutiny Committee Office in Tamas,,
1129,22,22,1,Gosain ji told me last night,,,,,,817,Imam Din Mohalla in Tamas,,
1132,20,22,1,Bakhshi was getting upset,,,,,,612,Congress Committee Office in Tamas,951|624|954,"Congress Committee Member, Jawaharlal Nehru in Tamas|Congress Committee Member (part of singing group), Desraj in Tamas|Congress Committee Member, Jeet Singh in Tamas"
1135,22,22,2,We're cleaing the drains in that mohalla?,,,,,,612,Congress Committee Office in Tamas,955,"Part of singing group, went for cleaning the drains, Gosain Ji in Tamas"
1160,42,43,2,I walked as though compelled across the shadowed courtyard,,,,,,1991,House in Sunlight on a Broken Column,,
1161,44,44,1,"After lunch, Aunt Abida said she wished to help Hakiman Bua prepare some Halva",,,,,,1991,House in Sunlight on a Broken Column,,
1164,44,46,2,Aunt Majida said Zahra and I were more a hindrance than a help,,,,,,1991,House in Sunlight on a Broken Column,,
1172,46,51,2,As she gushed towards us in her flowered dress and feathered hat,,,,,,1991,House in Sunlight on a Broken Column,,
1181,114,115,1,"When Harnam Singh knocked again, a woman called out",,Religion,,,TRUE,1294,"Ehsan Ali's home, Muridpur in Tamas",,
1182,115,116,1,The older woman stood up and washed her hands in a pan of water,,Religion,,,TRUE,1294,"Ehsan Ali's home, Muridpur in Tamas",96|91,"Ali, Ehsan in Tamas|Ali, Ramzan in Tamas"
1214,61,61,1,The whole village was on the roofs looking towards,,Nation,,,TRUE,704,Mano Majra Railway Station in Train to Pakistan,762,"Sikh Soldier 1, Unknown in Train to Pakistan"
1231,23,24,1,As soon as he set foot in the gali,,,,,,607,Ox-cart Road in Tamas,,
1249,24,24,1,Nathu felt as though he'd just stepped out for a stroll,,,,,,1251,Feeding trough in Tamas,219|227,"Committee Manager, Servant to Vet Sahib, Murad Ali in Tamas|Asked for the dead pig, Vet Sahib in Tamas"
1252,24,25,2,He had left the tonga-driver's mohalla,,,,,,828,Committee Park in Tamas,219,"Committee Manager, Servant to Vet Sahib, Murad Ali in Tamas"
1254,25,26,1,Nathu entered a narrow gali,,Religion|Nation,Religion,,TRUE,828,Committee Park in Tamas,1260,"Congress Committee Member, Mahatma Gandhi in Tamas"
1261,26,26,1,"Just then, Nathu saw Murad Ali standing at a slight distance",,,,,,817,Imam Din Mohalla in Tamas,,
1283,99,99,1,"Even since the night before, Banto had been saying",,,,,,1285,Harnam Singh's shop in Tamas,,
1284,100,100,1,Karim Khan returned just five minutes later.,,Religion,,,,1285,Harnam Singh's shop in Tamas,,
1287,100,101,2,Just then they heard the far off sound of a beating drum,,,,,,1285,Harnam Singh's shop in Tamas,660,"Muslim Leaue members from Harnam's village, Ashraf and Latif in Tamas"
1288,101,101,2,Banto and Harnam Singh came out and fixed the lock onto the shop,,,,,,1285,Harnam Singh's shop in Tamas,,
1290,101,102,3,The rioters had reached the top of the hill overlooking Harnam Singh’s shop.,,Religion,,,,1285,Harnam Singh's shop in Tamas,,
1291,103,104,1,"Walls are good for hiding people, but there were no walls here",,,,,,1179,Muridpur in Tamas,662|657,"Harnam Singh's daughter, Jasbir in Tamas|Singh, Iqbal in Tamas"
1296,116,117,2,Harnam Singh had trouble climbing up,,Religion,,,TRUE,1294,"Ehsan Ali's home, Muridpur in Tamas",96|91,"Ali, Ehsan in Tamas|Ali, Ramzan in Tamas"
1297,117,117,2,Darkness fell again in the crawl space.,,Religion,,,TRUE,1294,"Ehsan Ali's home, Muridpur in Tamas",659,"Khan, Karim in Tamas"
1302,117,118,3,"A little while later, Akran’s father-in-law and Akran entered the courtyard carrying a large black trunk",,Religion,,,TRUE,1294,"Ehsan Ali's home, Muridpur in Tamas",91,"Ali, Ramzan in Tamas"
1303,118,119,1,But then the same drama occurred that had taken place in the morning,,Religion,,,TRUE,1294,"Ehsan Ali's home, Muridpur in Tamas",662,"Harnam Singh's daughter, Jasbir in Tamas"
1304,119,119,1,They awoke to the sound of axe blows raining down upon their door,,Religion,,,TRUE,1294,"Ehsan Ali's home, Muridpur in Tamas",,
1305,120,120,1,It must have been around midnight when Rajo,,Religion,,,TRUE,1179,Muridpur in Tamas,,
1306,21,21,1,She allowed herself to be dragged onto the table,,,,,,1002,Rest House in Train to Pakistan,,
1308,121,121,1,While Harnam Singh and Banto were seeking shelter,,Religion,,,TRUE,1313,Fields and hills near Muridpur in Tamas,141|656,"Singh, Harnam in Tamas|Harnam Singh's wife, Banto in Tamas"
1309,21,21,2,Two shots rang out and silenced the barking and shouting,,,,,,1002,Rest House in Train to Pakistan,,
1310,21,21,3,Only a solitary Sikh peasant carrying an ironshod bamboo staff,,,,,,704,Mano Majra Railway Station in Train to Pakistan,,
1311,21,21,4,"from the compartment just behind the engine, armed policemen emerged",,,,,,704,Mano Majra Railway Station in Train to Pakistan,,
1312,21,22,5,The young man reached the gate first and stopped between the stationmaster and the police.,,,,,,704,Mano Majra Railway Station in Train to Pakistan,,
1314,22,22,2,He stepped into the open door of the temple courtyard.,,,,,,705,Gurudwara in Train to Pakistan,,
1315,122,122,1,One clever fellow had an idea,,Religion,Religion,,TRUE,1313,Fields and hills near Muridpur in Tamas,141,"Singh, Harnam in Tamas"
1317,122,123,2,After that they left the hilly area,,Religion,,,TRUE,1313,Fields and hills near Muridpur in Tamas,,
1318,123,123,1,The conversion ceremony began at the home of,,Religion,,,TRUE,1320,"Home of Imam Deen the oilman, Muridpur in Tamas",866,"Imam Deen the oilman, Unknown in Tamas"
1323,123,123,2,"After this, he was taken to the well",,Religion,Religion,,TRUE,1324,Well near Imam Deem's home in Tamas,,
1325,123,124,3,The procession then returned to the home of Imam,,Religion,Religion,,TRUE,1320,"Home of Imam Deen the oilman, Muridpur in Tamas",,
1326,24,25,2,He had spent the night sitting on his bedroll in a crowded third-class compartment,,,,,,1004,Train Compartment in Train to Pakistan,,
1328,22,24,4,"The old Sikh came to him, combing his long beard with his fingers.",,,,,,705,Gurudwara in Train to Pakistan,998|752|110,"Baksh, Mullah Imam in Train to Pakistan|12 Armed Policemen who get down the same train as Iqbal, Unknown in Train to Pakistan|Lal, Lala Ram in Train to Pakistan"
1329,25,26,1,Meet Singh came in exclaiming philosophically,,,,,,705,Gurudwara in Train to Pakistan,112|120,"Singh, Juggut in Train to Pakistan|Chand, Hukum in Train to Pakistan"
1351,22,22,1,The young man went out of the station towards the village.,,,,,,701,Mano Majra in Train to Pakistan,,
1357,22,22,3,The young man went into the room.,,,,,,705,Gurudwara in Train to Pakistan,,
1360,24,24,1,"In the afternoon, Iqbal stretched himself on the coarse string charpai and tried to get some sleep.",,,,,,705,Gurudwara in Train to Pakistan,,
1363,26,27,1,Iqbal stepped out of the gurdwara,,,,,,701,Mano Majra in Train to Pakistan,,
1364,27,27,1,Iqbal stood up and looked all round.,,,,,,704,Mano Majra Railway Station in Train to Pakistan,,
1365,27,27,2,Iqbal found his way back easily.,,,,,,701,Mano Majra in Train to Pakistan,,
1366,27,27,3,Iqbal went straight to his room and lay down on his charpai in the dark,,,,,,705,Gurudwara in Train to Pakistan,,
1369,27,27,4,A minute later Meet Singh stood,,,,,,705,Gurudwara in Train to Pakistan,768,"Singh, Banta in Train to Pakistan"
1370,27,27,5,Iqbal fished out his silver hip flask,,,,,,705,Gurudwara in Train to Pakistan,768,"Singh, Banta in Train to Pakistan"
1371,27,29,6,Then he got up to greet the visitors.,,,,,,705,Gurudwara in Train to Pakistan,,
1373,29,30,1,Iqbal lay down once more and gazed at the stars.,,,,,,705,Gurudwara in Train to Pakistan,,
1374,42,42,1,Early in September the time schedule in Mano Majra,,,,,TRUE,701,Mano Majra in Train to Pakistan,,
1378,42,42,2,This was not all that changed the life,,Nation|Religion,,,TRUE,706,Near the Railway Station in Train to Pakistan,,
1382,160,161,1,I STAYED at home the next day.,,Nation|Gender,,,FALSE,671,Hamid's Study in Sunlight on a Broken Column,315|318|426,"Hasan, Abida in Sunlight on a Broken Column|Hasan, Zahra in Sunlight on a Broken Column|Students, Unknown in Sunlight on a Broken Column"
1385,161,162,1,"Aunt Abida leaned against the large boulster,",,,,,FALSE,1991,House in Sunlight on a Broken Column,431|487|426,"Chatterjee, Nita in Sunlight on a Broken Column|Unknown, Asad in Sunlight on a Broken Column|Students, Unknown in Sunlight on a Broken Column"
1387,42,42,3,"One morning, a train from Pakistan halted at Mano Majra",,,,,TRUE,704,Mano Majra Railway Station in Train to Pakistan,693,"Unit of Sikh soldiers, Unknown in Train to Pakistan"
1388,162,162,1,"The sound of voices came in chanting unison,",,Nation,,,FALSE,1389,Road in front of the Hasan house in Sunlight on a Broken Column,431|487,"Chatterjee, Nita in Sunlight on a Broken Column|Unknown, Asad in Sunlight on a Broken Column"
1391,162,164,2,It did not surprise me when I saw,,,,,FALSE,1991,House in Sunlight on a Broken Column,431|374,"Chatterjee, Nita in Sunlight on a Broken Column|Police, Unknown in Sunlight on a Broken Column"
1392,164,164,1,When Aunt Saira and Zahra came back from,,,,,FALSE,1991,House in Sunlight on a Broken Column,321|487,"Hasan, Hamid in Sunlight on a Broken Column|Unknown, Asad in Sunlight on a Broken Column"
