2390,83,84,3,"When the prayer was over, Meet Singh wrapped the massive volume",,,Religion,,TRUE,705,Gurudwara in Train to Pakistan,112,"Singh, Juggut in Train to Pakistan"
2392,151,152,2,"In spite of Zahra's chatter, and my shyness, I looked around and recognised",,,Religion,,,2034,Baradari in Sunlight on a Broken Column,,
2421,125,125,1,"The Turks had come, but only from neighbouring villages",,Religion,,,TRUE,2423,Sayedpur in Tamas,,
2424,125,125,2,Now seven corpses shrouded in white sheets,,Religion,,,TRUE,2426,Gurudwara in Tamas,149|150|1241,"Sikh, Nihang in Tamas|Singh, Sohan in Tamas|Rasool, Sheikh Ghulam in Tamas"
2427,125,125,3,There were numerous bodies scattered about the town,,Religion,,,TRUE,2423,Sayedpur in Tamas,1247,"Oilman, Rahim in Tamas"
2433,76,76,7,"Secondly, Lala ji had just been wondering",,Religion,,,,2442,Lala ji's house in Tamas,,
2444,76,77,8,The blue Buick snaked its way through the empty streets,,,,,,211,THE CITY in Tamas,,
2445,125,125,4,Some bodies lay scattered about outside town,,,,,,2449,Outside Sayedpur in Tamas,2447|2400,"Sheik's, Children in Tamas|Deen, Fateh in Tamas"
2446,77,77,1,"And now, after dropping Lala ji and his family off",,,,,,2450,Saddar Bazaar in Tamas,749|2439|2404|2448,"Lala Ji, Elderly Gentleman, one of the outsiders attending the Executive Committee meeting, Lakshmi Narayan in Tamas|Narayan, Lala Lakshmi's daughter, Unknown in Tamas|Narayan/Lala Lakshmi's wife, Unknown in Tamas|Unknown, Raghunath, Yabu in Tamas"
2452,77,77,2,Shah Nawaz's car slowed down again. One felt the looming,,,,,,2456,Mai Satto tank in Tamas,2453,"Group of children, Unknown in Tamas"
2454,125,125,5,Khalsa School was still burning,,Religion,,,TRUE,154,Khalsa School in Tamas,,
2457,77,77,3,The car had now turned onto the big road.,,,,,,1240,Muslim neighbourhood in Tamas,,
2460,125,125,6,All the Sikh houses at theentrance to the left gali,,Religion,,,TRUE,2462,"entrance to the left gali, right at the edge of the river in Tamas",,
2463,77,78,4,He'd only driven a little further down the road when a crowd,,,,,,1240,Muslim neighbourhood in Tamas,2465,"Unknown dead, Muslim in Tamas"
2464,125,125,7,all threeof the butchers’ shops,,Religion,,,TRUE,1277,Teli Mohalla in Tamas,,
2466,78,78,1,Soon he turned and drove through a gate,,,,,,2469,Raghunath's house in Tamas,2467,"Raghunath's wife, Janaki in Tamas"
2468,125,125,8,ammunition at the gurdwara had pretty much run out,,Religion,,,TRUE,2426,Gurudwara in Tamas,,
2470,125,125,9,The ammunition had also run out on the other side,,Religion,,,TRUE,2472,Fortress of Sheik in Tamas,,
2471,78,78,2,Just then Raghunath came in,,,,,,2469,Raghunath's house in Tamas,2473,"Deputy Assistant Postmaster Sahib, Bhim in Tamas"
2474,126,126,1,The news from the spies was that the Muslims were expecting,,Religion,,,TRUE,2426,Gurudwara in Tamas,164,"Dad, Mir in Tamas"
2475,79,79,1,Janaki had brought the tea,,,,,,2469,Raghunath's house in Tamas,2476,"Raghunath's servant, Milkhi in Tamas"
2478,79,80,2,Afternoon was already waning when Shah Nawaz,,,,,,2479,Raghunath's ancestral home in Tamas,,
2480,80,80,1,Across the street was Feroz the Skinner's warehouse,,Religion,,,,2479,Raghunath's ancestral home in Tamas,,
2484,80,80,2,A tonga passed nearby. Shah Nawaz turned to look.,,,,,,2479,Raghunath's ancestral home in Tamas,2476,"Raghunath's servant, Milkhi in Tamas"
2489,80,80,3,He felt a wave of nostalgia as he entered the darkened veranda.,,,,,,2479,Raghunath's ancestral home in Tamas,2491|2492,"Raghunath's daughter, Unknown in Tamas|Raghunath's younger brother's wife, Unknown in Tamas"
2490,126,126,2,The moon had come out again,,Religion,,,TRUE,2426,Gurudwara in Tamas,1241,"Rasool, Sheikh Ghulam in Tamas"
2493,80,81,4,Shah Nawaz turned to glance at Milkhi,,,,,,2479,Raghunath's ancestral home in Tamas,2494|2495,"Raghunath's family, Group in Tamas|Raghunath's ancestral home's neighbour's naanbai, Unknown in Tamas"
2496,81,81,1,Milkhi began to climb the stairs after Shah Nawaz.,,,,,,2497,"Storeroom, Raghunath's ancestral home in Tamas",,
2498,126,127,3,Some people were sitting and talking on the stoop,,Religion,,,TRUE,1242,Sheikh Ghulam Rasool's house in Tamas,,
2500,127,127,1,When we got into the gali,,Gender,,,TRUE,2423,Sayedpur in Tamas,2510,"Fighter, Rapist, Jalal in Tamas"
2501,81,81,2,"Just then, he happened to glance through the open window",,,,,,726,Mosque in Tamas,,
2503,81,81,3,The two of them came back out of the room and walked down the stairs.,,Class,,,FALSE,2479,Raghunath's ancestral home in Tamas,,
2505,81,82,4,"That night, as he handed the jewellery box",,,,,,2469,Raghunath's house in Tamas,2476,"Raghunath's servant, Milkhi in Tamas"
2511,127,127,2,Another fighter began a story of his own,,Gender|Religion,,,TRUE,2514,Outside Karaar houses in Tamas,,
2515,127,127,3,The Junior Priest was walking slowly down the hill,,Religion,,,TRUE,2554,Down the hill in Tamas,,
2518,145,145,1,"A stocky contractor was telling Sheikh Noor Ilahi,",,,,,TRUE,2523,Christian College in Tamas,,
2521,145,145,2,"Munshiram stood looking around, then slowly sidled over",,Interpersonal,,,TRUE,2523,Christian College in Tamas,,
2524,145,146,3,Sheikh Noor Ilahi saw Lala Lakshmi Narayan,,,Religion,,TRUE,2523,Christian College in Tamas,,
2525,150,151,1,Richard and Liza were in the bungalow,,,,,TRUE,235,Richard & Liza's bungalow in Tamas,,
2526,146,147,1,Lala Shyam Lal had cornered Congress-committee,,Religion,,,TRUE,2523,Christian College in Tamas,2759,"Congress Candidate, Mangal Sen in Tamas"
2528,54,54,2,One morning a party of five men were brought,,Interpersonal,,,FALSE,1457,Chundunnugger Police Station in Train to Pakistan,,
2529,57,58,1,By eleven o’clock the rain had dwindled,,,,,FALSE,1457,Chundunnugger Police Station in Train to Pakistan,753|112|129|1475|804,"Unknown, Iqbal in Train to Pakistan|Singh, Juggut in Train to Pakistan|Malli, Unknown in Train to Pakistan|Dacoits including Malli who later get arrested., Unknown in Train to Pakistan|Baluchi and Pathan soldiers from Pakistan army, Unknown in Train to Pakistan"
2530,58,59,2,The subinspector put on his turban.,,,,,FALSE,1457,Chundunnugger Police Station in Train to Pakistan,,
2531,59,60,1,Malli had been shaken by Juggut Singh’s outburst,,Interpersonal,,,FALSE,1457,Chundunnugger Police Station in Train to Pakistan,,
2532,84,86,1,"Iqbal put his plates, knife, fork, and tins",,Religion,,,TRUE,705,Gurudwara in Train to Pakistan,,
2533,49,49,1,You came to my house instead of coming to the office,,Religion,Religion,,FALSE,2541,Deputy Commissioner's House in Tamas,2538,"Previous Deputy Commissioner, Unknown in Tamas"
2535,86,87,1,"In the courtyard of the gurdwara, the fires on",,,,,FALSE,705,Gurudwara in Train to Pakistan,,
2537,87,89,1,‘No fool like an old fool.’ The sentence kept,,Religion,,,TRUE,1002,Rest House in Train to Pakistan,729|129|112|118|1093|1094|1111|1140|1101|1104|1103|1108|1096|1097|1098|1099,"Begum, Haseena in Train to Pakistan|Malli, Unknown in Train to Pakistan|Singh, Juggut in Train to Pakistan|Nooran, Unknown in Train to Pakistan|Singh, Prem in Train to Pakistan|Goan bandleader, Mendoza in Train to Pakistan|Hukum Chand's orderly daughter, Sundari in Train to Pakistan|Ram, Mansa in Train to Pakistan|Singh, Sunder in Train to Pakistan|Singh, Deepo in Train to Pakistan|Singh, Shangara in Train to Pakistan|Singh, Amro in Train to Pakistan|Orchestra, McMello in Train to Pakistan|Orchestra, DeSilva in Train to Pakistan|Orchestra, DeSaram in Train to Pakistan|Orchestra, Gomes in Train to Pakistan"
2542,89,90,1,"A little after eleven, the moon came up.",,Religion,,,TRUE,1000,Railroad Bridge in Train to Pakistan,,
2543,49,49,2,Bakhshi felt irritable after all that,,Religion,,,,2541,Deputy Commissioner's House in Tamas,2544,"Muslim League President, Unknown in Tamas"
2545,183,187,1,"Nadira, Sita and I smiled at each other",,Class,,,,1950,Lawn in Sunlight on a Broken Column,,
2546,49,49,3,The government has a bad reputation,,Nation,,,,2541,Deputy Commissioner's House in Tamas,951|2547,"Congress Committee Member, Jawaharlal Nehru in Tamas|Nehru, Jawaharlal in Tamas"
2548,50,50,1,Lakshmi Narayan felt very much alone,,Religion,,,,2541,Deputy Commissioner's House in Tamas,713,"Muslims, Unknown in Tamas"
2550,50,50,2,If the police were to begin a patrol,,Religion,,,,2541,Deputy Commissioner's House in Tamas,2553|2556|2547|1281,"British Army Cantonment, Unknown in Tamas|British Government, Unknown in Tamas|Nehru, Jawaharlal in Tamas|Singh, Baldev in Tamas"
2551,194,197,2,"Ameer, waiting at the net for his partner",,Religion|Gender|Class,,,,1922,Tennis Court in Sunlight on a Broken Column,325|910|321|1083|1074|894|487|431|1735,"Agarwal, Sita in Sunlight on a Broken Column|Hasan, Kemal in Sunlight on a Broken Column|Hasan, Hamid in Sunlight on a Broken Column|Waliuddin, Sheikh in Sunlight on a Broken Column|Mr. Agarwal, Unknown in Sunlight on a Broken Column|Raja of Bhimnagar, Unknown in Sunlight on a Broken Column|Unknown, Asad in Sunlight on a Broken Column|Chatterjee, Nita in Sunlight on a Broken Column|Unknown, Begum Waheed in Sunlight on a Broken Column"
2555,128,128,1,"A band of Sikhs, the Senior Priest included",,Religion,,,TRUE,1637,Galli to left of gurudwara in Tamas,,
2560,50,51,3,Everyone else remained silent when they saw the direction,,Religion,Religion,,FALSE,2541,Deputy Commissioner's House in Tamas,2563|2565|2568,"Sahib, Police Officer, Robert in Tamas|Hindu Landlord, Unknown in Tamas|Muslim Tenant Family, Unknown in Tamas"
2561,128,128,2,"Another group of Sikhs standing outside the gurdwara, hair down, swords in hand, began to advanceinto the left-hand gali",,Religion,,,TRUE,2462,"entrance to the left gali, right at the edge of the river in Tamas",1040,"Faction, Turks in Tamas"
2562,128,129,3,"At that same moment, a stream of women emerged into the night,",,Gender|Religion,,,TRUE,2462,"entrance to the left gali, right at the edge of the river in Tamas",,
2570,199,200,2,The sounds of Aunt Saira's dandy,,Class,,,,1991,House in Sunlight on a Broken Column,920|1750,"Husain, Ameer in Sunlight on a Broken Column|Ali, Raza in Sunlight on a Broken Column"
2575,51,51,1,'A Hindu’s been murdered on the other side of the bridge,,Religion,,,,2541,Deputy Commissioner's House in Tamas,,
2578,204,205,1,It appeared that when Aunt Abida,,Gender|Religion,,,,370,"Lucknow, India in Sunlight on a Broken Column",,
2579,129,129,1,The moonlight was fading to yellow,,Religion,,,TRUE,2423,Sayedpur in Tamas,,
2582,129,129,2,A light still burned in the gurdwara,,Religion,,,TRUE,2426,Gurudwara in Tamas,,
2583,51,52,2,The men were confused as they emerged from the bungalow,,Religion,Interpersonal,,,2587,Outside the DC's House in Tamas,,
2585,129,129,3,"As daylight spread, kites and crows began to fly about",,Religion,,,TRUE,2423,Sayedpur in Tamas,,
2588,129,129,4,The fat butcher’s eldest son snuck up behind the gurdwara,,Religion,,,TRUE,2426,Gurudwara in Tamas,,
2593,129,129,5,there was astrange sound in the air: a deep buzzing,,Religion,,,TRUE,2423,Sayedpur in Tamas,,
2596,129,130,5,It was an airplane,,Religion,,,TRUE,2426,Gurudwara in Tamas,2599,"Jackson, Captain in Tamas"
2600,193,194,1,Tea had hardly finished when the,,Nation|Religion,,,,1922,Tennis Court in Sunlight on a Broken Column,,
2601,130,130,1,It was an airplane,,Religion,,,TRUE,2423,Sayedpur in Tamas,,
2602,198,199,1,When I returned Kemal had,,,,,,1991,House in Sunlight on a Broken Column,,
2606,120,130,2,Teja Singh was thinking he’d have to get to the city,,,,,TRUE,2426,Gurudwara in Tamas,167,"Deputy Commissioner, Richard in Tamas"
2610,83,83,1,Dev Dutt had bathed and was standing in front of his house,,,,,,2616,Dev Dutt's house in Tamas,2402|618|2613|2614,"Bakhsh, Hayat in Tamas|Congress Committee secretary, Bakhshi in Tamas|Ram, Raja in Tamas|Nath, Ram in Tamas"
2611,130,130,2,Teja Singh was thinking he’d have to get to the city quickly,,Religion,,,TRUE,2426,Gurudwara in Tamas,167,"Deputy Commissioner, Richard in Tamas"
2615,130,130,3,The fat butcher’s son standing behind the gurdwara poured,,Religion,,,TRUE,2426,Gurudwara in Tamas,,
2617,83,84,2,'Who's there? Dev Dutt?',,,,,,2616,Dev Dutt's house in Tamas,,
2619,130,130,4,airplane circled over the town three times,,Religion,Religion,,TRUE,2423,Sayedpur in Tamas,,
2621,130,130,5,The caretaker and the Nihang Sikh set about cleaning,,,,,,2426,Gurudwara in Tamas,,
2623,84,84,1,"By then, Dev Dutt had already reached the chowk.",,Religion,Religion,,,2624,Unknown Chowk in Tamas,,
2626,84,84,2,The man lying in the street ahead was not altogether dead.,,Religion,,,,2624,Unknown Chowk in Tamas,,
2629,84,85,3,Tje [artu pffoce was covered with flags.,,Nation,Class,,,2634,Communist Party Office in Tamas,,
2636,85,85,1,The meeting began. The first item was 'The state of the city'.,,,Nation,,,2634,Communist Party Office in Tamas,2637|2638|2411|2402|618,"Comrade, Jagdish in Tamas|Ali, Qurban in Tamas|Nawaz, Shah in Tamas|Bakhsh, Hayat in Tamas|Congress Committee secretary, Bakhshi in Tamas"
2639,130,130,6,"Meanwhile, the mosque was also being cleaned, under order of the Sheikh",,,,,TRUE,726,Mosque in Tamas,1241,"Rasool, Sheikh Ghulam in Tamas"
2640,85,86,2,"But after the meeting, Dev Dutt and Aziz",,Religion,,,,211,THE CITY in Tamas,2402,"Bakhsh, Hayat in Tamas"
2641,86,86,1,And there really was a meeting at Hayat Bakhsh's house,,Religion,,,,2644,Hayat Bakhsh's house in Tamas,,
2646,86,86,2,"Then people grew tired, and Hayat Bakhsh's son",,Religion,,,,2644,Hayat Bakhsh's house in Tamas,,
2648,86,86,3,a riot had broken out in the labourer's colony,,Religion,,,,2650,Ratta in Tamas,,
2651,86,86,4,But when he managed to somehow get back to the office,,,,,,2634,Communist Party Office in Tamas,2620|2614,"Dev Dutt's mother, Unknown in Tamas|Nath, Ram in Tamas"
2652,86,87,5,"That same afternoon, there was another death.",,Religion,,,,2653,Committee Mohalla in Tamas,951|1260,"Congress Committee Member, Jawaharlal Nehru in Tamas|Congress Committee Member, Mahatma Gandhi in Tamas"
2658,52,52,1,"In the meantime, the other three men",,Religion,Religion,,,2587,Outside the DC's House in Tamas,,
2662,52,52,2,"Lakshmi Narayan, walking along in the very back, hoped",,Religion,Religion,,,2587,Outside the DC's House in Tamas,,
2663,52,53,3,"Bakhshi, seated in the tonga, felt very distressed",,Religion,,,,2668,On the way back to the city from the DC's house in Tamas,167|2664|713|2665|2666|2667,"Deputy Commissioner, Richard in Tamas|Hindus of the ciy, Unknown in Tamas|Muslims, Unknown in Tamas|Ali, member of District Congress Committee, Mubarak in Tamas|A Congress Muslim, Muzaffar in Tamas|Hindu Sabha Members, Unknown in Tamas"
2669,53,53,1,"Go drown, Mehta, go drown in a handful of water",,Religion,Interpersonal,,,2668,On the way back to the city from the DC's house in Tamas,619|2659|2665|2670,"Ahmad, Congress Committee Member, Aziz in Tamas|Hakim Ghani, Abdul in Tamas|Ali, member of District Congress Committee, Mubarak in Tamas|Unknown, Latif in Tamas"
2671,53,54,2,The other four men were still walking down the hill,,Religion,Nation|Interpersonal|Religion,,,2672,in front of the Electricity Office in Tamas,167,"Deputy Commissioner, Richard in Tamas"
2673,54,55,1,At around twelve o’clock,,,,,,2541,Deputy Commissioner's House in Tamas,167|2676|2677|209,"Deputy Commissioner, Richard in Tamas|wives of British Officers, Unknown in Tamas|Commissioner's wife, Unknown in Tamas|Deen, Richard & Liza's cook, Roshan in Tamas"
2678,55,56,1,She went out to the veranda through the dining room door.,,,,,,2541,Deputy Commissioner's House in Tamas,167,"Deputy Commissioner, Richard in Tamas"
2685,58,59,1,"At the tailor Khuda Bakhsh’s shop,",,,,,,2412,Shivala Bazaar in Tamas,,
2688,66,66,1,The lambardar felt a strong sense of guilt and was overcome with emotion. He got up and embraced Imam Baksh and started to cry loudly,,,Religion,,TRUE,1163,Lambardar's House in Train to Pakistan,,
2689,66,66,3,Imam Baksh and his companions left the meeting in tears.,,,Religion,,FALSE,1163,Lambardar's House in Train to Pakistan,,
2691,66,66,4,"Before going round to other Muslim homes, Imam Baksh went to his own hut attached to the mosque",,,,,FALSE,1170,Imam Baksh's House in Train to Pakistan,,
2692,66,66,5,Nooran rubbed her face with her hands and stared at the wall. She did not know what to do.,,,,,TRUE,1170,Imam Baksh's House in Train to Pakistan,,
2693,66,66,7,In most houses she could see the dim flickers of oil lamps. Some were packing; others were helping them to pack.,,,Religion,,TRUE,701,Mano Majra in Train to Pakistan,,
2694,66,66,8,Nooran shook the door of Jugga’s house.,,,,,FALSE,938,Juggut's House in Train to Pakistan,,
2696,67,67,1,"Nooran stood up and mumbled indistinctly, ‘Beybey.’",,Interpersonal,,,,938,Juggut's House in Train to Pakistan,1012,"Singh (Juggut's Mother), Beybey in Train to Pakistan"
2697,67,67,2,Nooran began to cry. ‘We are going away tomorrow.’,,,,,TRUE,938,Juggut's House in Train to Pakistan,,
2698,67,67,3,"‘Get out, you bitch!’ the old woman hissed. ‘You, a Muslim weaver’s daughter, marry a Sikh peasant!",,Religion|Interpersonal|Class,,,FALSE,938,Juggut's House in Train to Pakistan,112,"Singh, Juggut in Train to Pakistan"
2699,67,67,5,"‘Beybey, I have Jugga’s child inside me. If I go to Pakistan they will kill it when they know it has a Sikh father.’",,Religion,,,TRUE,938,Juggut's House in Train to Pakistan,112,"Singh, Juggut in Train to Pakistan"
2700,68,68,3,There was not much for Nooran to do,,,,,TRUE,1170,Imam Baksh's House in Train to Pakistan,,
2701,68,68,5,The convoy went around Mano Majra looking for a lane wide enough to let their trucks in.,,,,,TRUE,701,Mano Majra in Train to Pakistan,,
2703,68,68,8,"Slowly the Muslims began to come out of their homes, driving their cattle and their bullock carts",,,Religion,,TRUE,1218,Peepul Tree near the Temple in Train to Pakistan,,
2705,69,69,1,The rest of Mano Majra came out to see them off.,,,Religion|Interpersonal,,TRUE,1218,Peepul Tree near the Temple in Train to Pakistan,806,"Mano Majra Muslims, Unknown in Train to Pakistan"
2706,69,69,3,"""No, we will not touch anything. We will only look after their houses.""",,,Interpersonal|Religion,,TRUE,1218,Peepul Tree near the Temple in Train to Pakistan,806,"Mano Majra Muslims, Unknown in Train to Pakistan"
2707,69,69,4,"‘Do not taunt us like this, Captain Sahib. We are brothers and will always remain brothers.’",,,Religion|Interpersonal,,FALSE,1218,Peepul Tree near the Temple in Train to Pakistan,806,"Mano Majra Muslims, Unknown in Train to Pakistan"
2709,69,69,5,The Muslim officer got on the jeep and addressed the crowd.,,,,,TRUE,1218,Peepul Tree near the Temple in Train to Pakistan,,
2710,70,70,1,"Before the Sikh could answer, a babel of protests burst from all sides.",,,Religion,,TRUE,1218,Peepul Tree near the Temple in Train to Pakistan,,
2711,131,131,1,Coming out onto the streets in the city,,,,,TRUE,211,THE CITY in Tamas,,
2712,70,70,2,‘I give you five minutes to get into the trucks with just as much luggage as you can carry in your hands.',,Interpersonal,,,TRUE,1218,Peepul Tree near the Temple in Train to Pakistan,,
2713,70,70,3,"Truck engines were started. Pathan soldiers rounded up the Muslims,",,,,,TRUE,1218,Peepul Tree near the Temple in Train to Pakistan,,
2714,59,60,1,A man stood on the ladder,,,,,,2412,Shivala Bazaar in Tamas,,
2715,70,70,4,The Sikhs watched them till they were out of sight.,,,Religion,,TRUE,1218,Peepul Tree near the Temple in Train to Pakistan,806,"Mano Majra Muslims, Unknown in Train to Pakistan"
2716,60,61,1,The thread of conversation began with the incident,,,,,,2416,Fazal Din's Naan Shop in Tamas,,
2717,62,62,1,"In the midst of this, a tonga came and stopped",,,,,,2416,Fazal Din's Naan Shop in Tamas,,
2718,63,63,1,"Just then, there was another disturbance in the street",,,,,,2416,Fazal Din's Naan Shop in Tamas,,
2721,131,131,2,The news had spread by word of mouth,,,,,TRUE,211,THE CITY in Tamas,,
2725,131,131,3,It was said that two camps were opening up,,,Nation,,TRUE,211,THE CITY in Tamas,167,"Deputy Commissioner, Richard in Tamas"
2726,131,131,4,A continuous stream of villagers visited the Congress-run relief,,Nation,Nation,,TRUE,2728,Congress Run Relief in Tamas,,
2729,131,132,5,"Out on his rounds, Richard’s jeep had stopped",,,Class,,TRUE,2732,"Health Officer, Mr Kapoor's house in Tamas",,
2733,132,132,1,In the village where the women and children,,Class,,,TRUE,2423,Sayedpur in Tamas,,
2735,147,147,1,"In the meantime, Lala Lakshmi Narayan was asking Hayat Baksh",,Religion,,,TRUE,2523,Christian College in Tamas,796,"Chairman's Son, Ranvir in Tamas"
2736,147,147,2,Two chaprasis from the college were sitting,,Class,,,TRUE,2523,Christian College in Tamas,,
2739,147,148,3,"Just then, a debate broke out between a young member",,Nation|Religion,,,TRUE,2523,Christian College in Tamas,,
2744,132,132,2,‘What do you think about cremating the dead?,,,Class,,TRUE,2746,Outside Health Officer Kapoor's house in Tamas,,
2749,148,149,1,"Lucas Sahib began to speak: 'I think, right now, we should all get together",,,Religion,,TRUE,2523,Christian College in Tamas,,
2750,132,133,3,"Ten minutes later, he was giving details on the government’s relief work",,,Nation,,TRUE,137,Relief Committee Office in Tamas,2757,"City Elected, Officials in Tamas"
2755,149,149,1,"At this, Master Ram Das stood up and said",,Religion,,,TRUE,2523,Christian College in Tamas,,
2758,64,65,1,"Suddenly, the fakir sat up and stared back at Nathu.",,,,,,617,Bara Bazaar in Tamas,,
2761,149,150,2,The matter hadn't yet been decided,,,Religion,,TRUE,2762,Peace Bus in Tamas,,
2763,133,133,1,The Relief Committee members were just getting up when,,,Nation,,TRUE,137,Relief Committee Office in Tamas,1260|2765|2766,"Congress Committee Member, Mahatma Gandhi in Tamas|League, Muslim in Tamas|Committee, Congress in Tamas"
2768,134,134,1,While Richard was making the rounds in the city,,,,,TRUE,211,THE CITY in Tamas,,
2769,134,134,2,Liza was going mad with boredom,,Interpersonal,,,FALSE,235,Richard & Liza's bungalow in Tamas,,
2771,134,134,3,And then she’d return to the dining room with a faint groan,,Interpersonal,,,FALSE,235,Richard & Liza's bungalow in Tamas,,
2772,134,134,4,Richard returned at around eight o’clock.,,Interpersonal,,,FALSE,235,Richard & Liza's bungalow in Tamas,,
2773,134,134,5,When he was transferred here he’d got this sofa from Commissioner Lawrence,,,,,,235,Richard & Liza's bungalow in Tamas,167|169,"Deputy Commissioner, Richard in Tamas|Richard's wife, Liza in Tamas"
2777,135,136,1,Liza woke up when they reached the bedroom,,Interpersonal,,,FALSE,235,Richard & Liza's bungalow in Tamas,2731|2734,"Health Officer's Wife, Mrs Kapoor in Tamas|Unknown Dead by drowning, Women in Tamas"
2778,108,108,1,Aunt Abida had become very quiet and spent a longer time,,,,,,2779,Mosque in Sunlight on a Broken Column,,
2780,108,111,2,There was silence while Uncle Hamid took his pouch,,,,,,2166,Hasan family house in Sunlight on a Broken Column,1962,"Hasan, Mohsin in Sunlight on a Broken Column"
2781,65,66,2,"Just then, he saw Murad Ali walking towards him",,,,,,617,Bara Bazaar in Tamas,,
2782,113,113,1,Once again the house at Hasanpur,,,,,,1991,House in Sunlight on a Broken Column,682,"Unknown, Prophet in Sunlight on a Broken Column"
2783,113,113,2,The elders were more curious about Zahra's dowry,,,,,,1991,House in Sunlight on a Broken Column,,
2784,66,68,2,"When the door opened, and Nathu’s wife saw him",,,,,,1663,Nathu's Room (Home) in Tamas,219,"Committee Manager, Servant to Vet Sahib, Murad Ali in Tamas"
2785,124,126,1,Shortly after we met she asked me,,,,,,2788,College in Sunlight on a Broken Column,1735,"Unknown, Begum Waheed in Sunlight on a Broken Column"
2786,68,68,2,Just then dogs began to bark loudly across the field,,,,,,1663,Nathu's Room (Home) in Tamas,,
2787,68,69,2,"Far outside the city, this same uproar,",,,,,,235,Richard & Liza's bungalow in Tamas,,
2809,70,71,1,‘This house is always in a state of chaos,,,,,,2442,Lala ji's house in Tamas,796,"Chairman's Son, Ranvir in Tamas"
2810,71,71,2,When Lala ji peered down over the wall,,,,,,2442,Lala ji's house in Tamas,,
2811,72,73,2,"‘Good God, there’s no telling with him!’",,Interpersonal,,,,2442,Lala ji's house in Tamas,796|2411,"Chairman's Son, Ranvir in Tamas|Nawaz, Shah in Tamas"
2812,73,73,2,Just then they heard the echo of slogans from a distance.,,Religion,,,,2415,Shiva Temple in Tamas,,
2813,73,74,3,"‘Listen, Ranvir’s mother, call Nanaku up here.’",,,,,,2442,Lala ji's house in Tamas,796|2407|739|2411,"Chairman's Son, Ranvir in Tamas|Narayan, Vidya in Tamas|Vrat, Master Dev, head of the akhara in Tamas|Nawaz, Shah in Tamas"
2814,74,74,1,But then they heard the sound of someone running in the back gali.,,Religion,,,,2442,Lala ji's house in Tamas,796,"Chairman's Son, Ranvir in Tamas"
2815,1,1,1,If only she could take the worm out of her womb and fling it away!,,,,,FALSE,334,Rashida's home in Pinjar,248,"Sahukars, Pooro in Pinjar"
2816,1,1,2,Memories of the days past came crowding into her mind.,,,,,FALSE,334,Rashida's home in Pinjar,248,"Sahukars, Pooro in Pinjar"
2817,1,1,3,"The first thing Pooro’s parents did on their return to Chitto was to find a young man – the son of a well-to-do family in the neighbouring village, Rattoval – for the hand of their daughter.",,,,,FALSE,334,Rashida's home in Pinjar,248|282|584|2434|2440,"Sahukars, Pooro in Pinjar|Chand, Ram in Pinjar|Chand, Ram's Mother in Pinjar|Sahukar, Pooro's Mother in Pinjar|Sahukar, Pooro's Father in Pinjar"
