2818,1,1,4,"The first thing Pooro’s parents did on their return to Chitto was to find a young man – the son of a well-to-do family in the neighbouring village, Rattoval – for the hand of their daughter.",,,,,FALSE,334,Rashida's home in Pinjar,248|282|584|2434|2440,"Sahukars, Pooro in Pinjar|Chand, Ram in Pinjar|Chand, Ram's Mother in Pinjar|Sahukar, Pooro's Mother in Pinjar|Sahukar, Pooro's Father in Pinjar"
2819,2,3,1,The women of the village brought cowdung and made an idol in her courtyard.,,,Religion,,FALSE,338,"Pooro's home, Chatto village in Pinjar",2434|293,"Sahukar, Pooro's Mother in Pinjar|Village Women, Unkown in Pinjar"
2820,3,3,1,Pooro was now fifteen. She felt a strange upsurge of blood in her limbs.,,,,,FALSE,2821,Neighbouring Market in Pinjar,282,"Chand, Ram in Pinjar"
2822,3,3,2,There was another reason to be cautious – the Muslims had become very aggressive.,,Religion,,,FALSE,2821,Neighbouring Market in Pinjar,,
2823,3,3,3,She would keep her friends engaged in gossip while her eyes watched the footpath which led to Ram Chand’s village.,,,Interpersonal,,FALSE,2824,Field in Pinjar,,
2825,5,6,1,"A man suddenly emerged from behind a peepul tree and stood in the middle of the path, barring her way. It was the Muslim lad, Rashida.",,Interpersonal,,,FALSE,2824,Field in Pinjar,,
2826,6,6,1,Rashida was standing by the trunk of a tree staring at her. Pooro felt the blood drain from her legs.,,Interpersonal,,,FALSE,2824,Field in Pinjar,,
2827,7,8,1,Pooro ran up to her mother and clasped her by the knees. Mother and daughter burst into tears.,,,Interpersonal,,FALSE,2829,Pooro's courtyard in her home in Pinjar,282,"Chand, Ram in Pinjar"
2830,7,8,2,She reeled under the blow; she felt a human arm entwine about her waist and lift her into the air.,,Interpersonal,,,FALSE,2824,Field in Pinjar,,
2831,8,9,1,"She had lost consciousness, and when she came to her senses she found herself on a charpoy in a room with the door shut.",,Interpersonal,,,FALSE,334,Rashida's home in Pinjar,,
2832,8,9,2,She reeled under the blow; she felt a human arm entwine about her waist and lift her into the air.,,Interpersonal,,,FALSE,2824,Field in Pinjar,,
2836,8,9,3,"She sat up on the charpoy. “Where am I?” “You are with me,” was his simple reply.",,,,,FALSE,334,Rashida's home in Pinjar,248|297,"Sahukars, Pooro in Pinjar|Shaikh, Rashida in Pinjar"
2837,8,9,4,“My sins be forgiven me! Speak to me just once!” said a voice beside her. Pooro raised her fevered head. It was Rashida.,,,,,FALSE,334,Rashida's home in Pinjar,,
2844,290,291,1,Nandi had remained unquestioningly loyal throughout the period,,Gender,,,FALSE,1991,House in Sunlight on a Broken Column,1796|1906,"Nandi's father, Unknown in Sunlight on a Broken Column|Nandi's husband, Unknown in Sunlight on a Broken Column"
2856,291,292,1,Agarwal's business prospered with the war.,,,,,FALSE,2147,Hasanpur in Sunlight on a Broken Column,325|2857|1796|1906|2860|2861,"Agarwal, Sita in Sunlight on a Broken Column|Architect, Unknown in Sunlight on a Broken Column|Nandi's father, Unknown in Sunlight on a Broken Column|Nandi's husband, Unknown in Sunlight on a Broken Column|Americans, Unknown in Sunlight on a Broken Column|Beggar-girls and boys, Unknown in Sunlight on a Broken Column"
2862,292,293,1,"""Oh no,"" protested Nandi, greatly shocked.",,,,,FALSE,2147,Hasanpur in Sunlight on a Broken Column,2863|2865,"Father of Nandi's child, Unknown in Sunlight on a Broken Column|Nandi's son, Unknown in Sunlight on a Broken Column"
2882,53,53,1,Once more the husband and wife fell silent,,,,,FALSE,355,Sakkar village in Pinjar,,
2883,53,54,2,It was said that men were being slaughtered,,Religion|Nation,,,TRUE,355,Sakkar village in Pinjar,,
2884,54,54,1,"With her own eyes, Hamida saw men",,Religion|Nation,,,TRUE,355,Sakkar village in Pinjar,,
2886,54,54,2,The streets ran with blood and were,,Religion|Nation,,,TRUE,2887,India in Pinjar,,
2888,54,54,3,"In some cities, barricades were put up to divide",,Religion,,,TRUE,2887,India in Pinjar,,
2889,54,54,4,"Some had been forced into marriage, some murdered",,Religion|Gender,,,TRUE,2887,India in Pinjar,,
2890,54,54,5,In Hamida’s village they beat drums of joy,,,,,TRUE,355,Sakkar village in Pinjar,248,"Sahukars, Pooro in Pinjar"
2892,54,55,6,"Every day, with   the Muslims foregathered",,Religion,,,TRUE,355,Sakkar village in Pinjar,,
2893,55,55,1,The Hindus in the villages next to theirs began to flee,,Religion,,,TRUE,2894,Neighbouring Village to Sakkar in Pinjar,,
2895,55,55,3,The Hindus moved into one home for safety,,Religion,,,TRUE,338,"Pooro's home, Chatto village in Pinjar",,
2896,55,55,4,They broke into the homes of the Hindus,,Religion,,,TRUE,338,"Pooro's home, Chatto village in Pinjar",571,"Hindus of Chatto, Unkown in Pinjar"
2897,55,55,2,"They fled during the night, but some were",,Religion,,,TRUE,2894,Neighbouring Village to Sakkar in Pinjar,,
2898,55,55,5,One morning they decided to assault the house,,Religion,,,TRUE,338,"Pooro's home, Chatto village in Pinjar",,
2899,55,55,7,Just then an Indian armed military convoy drove,,,,,TRUE,338,"Pooro's home, Chatto village in Pinjar",,
2900,55,55,8,The soldiers ignored the protests of their relatives,,Religion,,,TRUE,338,"Pooro's home, Chatto village in Pinjar",571,"Hindus of Chatto, Unkown in Pinjar"
2901,56,56,1,One day Hamida saw a band of a dozen or,,Gender,,,,355,Sakkar village in Pinjar,,
2902,56,56,2,That evening Hamida discovered a young girl,,Nation,,,TRUE,355,Sakkar village in Pinjar,,
2903,56,56,3,"After sunset, bands of goondas stole in",,Gender,,,FALSE,355,Sakkar village in Pinjar,,
2904,56,56,4,She escaped from the clutches of her ravishers,,Gender,,,FALSE,355,Sakkar village in Pinjar,,
2905,56,56,5,Hamida hid the girl in one of the rooms,,,,,FALSE,355,Sakkar village in Pinjar,,
2906,56,56,6,Next morning strangers came to Chatto,,Gender,,,TRUE,338,"Pooro's home, Chatto village in Pinjar",574,"Young Refugee Girl, Unknown in Pinjar"
2907,56,57,7,The following evening a convoy of refugees,,Nation,,,TRUE,2912,Refugee Encampment outside Chatto in Pinjar,,
2908,57,57,1,She spotted Ram Chand in the midst of the crowd,,,Interpersonal|Religion,,TRUE,2912,Refugee Encampment outside Chatto in Pinjar,,
2909,57,57,2,Hamida told her husband that she meant,,,Religion,,FALSE,355,Sakkar village in Pinjar,,
2914,57,58,3,The two women slipped past the sentries,,,,,FALSE,2912,Refugee Encampment outside Chatto in Pinjar,2434|2440|258|261|580,"Sahukar, Pooro's Mother in Pinjar|Sahukar, Pooro's Father in Pinjar|Sahukars, Unknown 2 in Pinjar|Sahukars, Unknown 3 in Pinjar|Sahukars, Lajo in Pinjar"
2915,58,58,1,"""She was with us when we left our home",,,,,TRUE,2912,Refugee Encampment outside Chatto in Pinjar,580|584,"Sahukars, Lajo in Pinjar|Chand, Ram's Mother in Pinjar"
2916,59,59,1,Then Hamida introduced the girl she had brought,,,Interpersonal,,FALSE,2912,Refugee Encampment outside Chatto in Pinjar,,
2917,59,59,2,The sentries started to awaken the refugees,,,,,TRUE,2912,Refugee Encampment outside Chatto in Pinjar,,
2918,60,60,1,"As she turned back, a police constable",,,,,FALSE,2912,Refugee Encampment outside Chatto in Pinjar,,
2922,294,294,1,There was a fountain at one end of the garden,,,,,,1991,House in Sunlight on a Broken Column,325|321|1083,"Agarwal, Sita in Sunlight on a Broken Column|Hasan, Hamid in Sunlight on a Broken Column|Waliuddin, Sheikh in Sunlight on a Broken Column"
2923,294,295,2,Waliuddin had not been successful like his friend,,Religion,,,TRUE,1991,House in Sunlight on a Broken Column,1083,"Waliuddin, Sheikh in Sunlight on a Broken Column"
2924,295,296,2,Sita was a leader in the new social world,,,,,,1991,House in Sunlight on a Broken Column,325,"Agarwal, Sita in Sunlight on a Broken Column"
2925,296,297,2,It was the Sita she had not been able to destroy who had travelled a day and night,,Interpersonal,,,,1991,House in Sunlight on a Broken Column,325,"Agarwal, Sita in Sunlight on a Broken Column"
2926,297,298,2,The sound of a long shut door being pushed open,,,,,,1991,House in Sunlight on a Broken Column,318|910|913|487,"Hasan, Zahra in Sunlight on a Broken Column|Hasan, Kemal in Sunlight on a Broken Column|Hasan, Saleem in Sunlight on a Broken Column|Unknown, Asad in Sunlight on a Broken Column"
2931,91,92,2,On a wide sandy space by the river,,,,,,2320,Wide sandy space on the river in Sunlight on a Broken Column,2117,"Unknown, Nawabs in Sunlight on a Broken Column"
2936,181,181,1,My uncle and aunt stood by the,,,,,FALSE,1950,Lawn in Sunlight on a Broken Column,,
2938,181,182,3,When the scarlet livery of the,,,,,,1950,Lawn in Sunlight on a Broken Column,,
2947,187,189,2,Nothing could have been more welcome,,,,,,1950,Lawn in Sunlight on a Broken Column,,
2948,190,192,1,We met two long days after,,,,,,1922,Tennis Court in Sunlight on a Broken Column,487|2207,"Unknown, Asad in Sunlight on a Broken Column|Unknown, Zahid in Sunlight on a Broken Column"
2949,198,199,1,When I returned Kemal had assumed,,Class|Interpersonal,,,,1991,House in Sunlight on a Broken Column,,
2951,205,205,2,I went to Aunt Saira to ask her,,Gender,,,,1991,House in Sunlight on a Broken Column,315|910,"Hasan, Abida in Sunlight on a Broken Column|Hasan, Kemal in Sunlight on a Broken Column"
2954,208,214,3,Only Sita was with Ranjit when,,Gender|Religion,,,,2068,Boathouse in Sunlight on a Broken Column,1750|920|2300,"Ali, Raza in Sunlight on a Broken Column|Husain, Ameer in Sunlight on a Broken Column|Singh, Hari in Sunlight on a Broken Column"
2955,214,216,2,The bathroom door was unlatched. I hurried,,Religion,,,,2068,Boathouse in Sunlight on a Broken Column,910,"Hasan, Kemal in Sunlight on a Broken Column"
2956,216,218,2,"""Oh, here you are!"" Sona Lal's",,,,,,2068,Boathouse in Sunlight on a Broken Column,1750|910,"Ali, Raza in Sunlight on a Broken Column|Hasan, Kemal in Sunlight on a Broken Column"
2957,72,72,2,Anyone caught in the talons of a kite as ugly as this would soon be reduced to a sparrow’s skeleton.,,,,,,559,Rattoval in Pinjar,,
2958,73,73,1,She wished she could grow wings and fly away.,,,,,,559,Rattoval in Pinjar,,
2959,75,75,2,"It was a mercy, otherwise she would have been in a worse plight",,,,,,355,Sakkar village in Pinjar,,
2960,79,79,5,his mind only dwelt on the fact that Rashida had abducted his sister.,,,,,,863,Lahore in Pinjar,297,"Shaikh, Rashida in Pinjar"
2965,80,80,3,she had only to say that she was a Hindu,,,,,,863,Lahore in Pinjar,,
2966,80,80,4,"like thousands of other women in the country, she too could",,,,,,863,Lahore in Pinjar,580,"Sahukars, Lajo in Pinjar"
2967,79,79,6,Lajo’s husband could not bring himself to say anything,,,,,,863,Lahore in Pinjar,,
2968,79,79,7,an hour of reunion would be followed by a final separation,,,,,,863,Lahore in Pinjar,2963,"Sahukars, Pooro's brother in Pinjar"
2979,281,281,1,He showed her affection which he,,,,,FALSE,1991,House in Sunlight on a Broken Column,920,"Husain, Ameer in Sunlight on a Broken Column"
2980,282,282,1,Saleem left home to join a British,,Interpersonal,Interpersonal,,TRUE,2147,Hasanpur in Sunlight on a Broken Column,,
2981,282,282,2,"There came the war, Japanese",,Nation,Nation,,TRUE,2147,Hasanpur in Sunlight on a Broken Column,,
2982,282,282,2,"There came the war, the Japanese threat",,Nation,Nation,,TRUE,2147,Hasanpur in Sunlight on a Broken Column,,
2983,283,284,2,1947 came the partition of country,,Nation,,,TRUE,2147,Hasanpur in Sunlight on a Broken Column,,
2984,283,283,2,He was buried with traditional religious ceremony,,,,,TRUE,2147,Hasanpur in Sunlight on a Broken Column,,
2985,284,284,1,At this table the family had gathered and,,,,,TRUE,1991,House in Sunlight on a Broken Column,,
2986,285,285,1,That last meal together at Ashiana,,,,,TRUE,1915,Ashiana in Sunlight on a Broken Column,,
2987,287,287,1,Saleem looked somewhat discomfitted,,Interpersonal,Religion,,TRUE,1915,Ashiana in Sunlight on a Broken Column,,
2988,289,289,1,":Less than two months later, Saleem and Nadira",,Interpersonal,Nation,,TRUE,1915,Ashiana in Sunlight on a Broken Column,913|433,"Hasan, Saleem in Sunlight on a Broken Column|Waheed, Nadira in Sunlight on a Broken Column"
2997,61,61,4,She asked them about the homes evacuated by the Hindus,,Religion,,,FALSE,559,Rattoval in Pinjar,,
2998,61,61,5,an old woman had turned her away from the door,,,,,FALSE,2754,Lajo's House in Pinjar,,
2999,62,63,4,"She refuses to cohabit with my boy,",,Interpersonal|Gender|Religion,,,FALSE,2754,Lajo's House in Pinjar,,
3000,63,63,1,Life her away just as you lifted me on to your saddle,,Gender|Religion,,,FALSE,334,Rashida's home in Pinjar,,
3001,63,63,2,exchanged for others similarly abducted by Indians,,Religion|Nation,,,TRUE,334,Rashida's home in Pinjar,,
3002,63,63,3,A sense of resentment surged in Hamida’s mind,,Religion|Gender,,,TRUE,334,Rashida's home in Pinjar,,
3003,63,63,4,neither her parents nor her in- laws-to-be had been willing to accept her,,Religion|Gender|Interpersonal,,,FALSE,334,Rashida's home in Pinjar,,
3004,64,64,2,he often used to say that Allah was her step-father or she the step-daughter of Isvara,,,Religion,,FALSE,334,Rashida's home in Pinjar,,
3005,64,64,3,She fervently invoked all the gods to help her in her mission and pushed open the door.,,,,,FALSE,334,Rashida's home in Pinjar,,
3006,66,66,1,She felt a new life pulsating in her limbs,,,,,FALSE,2754,Lajo's House in Pinjar,,
3007,66,66,2,was married and from which my bridal palanquin was taken,,Gender,,,FALSE,2754,Lajo's House in Pinjar,,
3008,66,66,3,I have become a stranger in my own home,,,,,FALSE,2754,Lajo's House in Pinjar,,
3009,67,67,3,she went about the task like one doing a final chore,,,,,FALSE,2754,Lajo's House in Pinjar,,
3010,67,67,4,Three times the ladle with which Lajo was stirring the lentils and rice slipped,,Gender,,,FALSE,2754,Lajo's House in Pinjar,,
3021,37,38,2,A pariah dog ran across,,,,,,1450,Enroute Chundunnugger in Train to Pakistan,,
3026,52,53,2,From inside the rest house came the sound,,,,,FALSE,1002,Rest House in Train to Pakistan,1468|1510,"Subinspector, Unknown in Train to Pakistan|Old woman who accompanies Haseena Begum, Unknown in Train to Pakistan"
3027,53,54,1,"‘There you go again with your deep thoughts,",,Religion,Religion,,TRUE,1002,Rest House in Train to Pakistan,1468|1184,"Subinspector, Unknown in Train to Pakistan|Party of Hijras in Chundunnugger, Unknown in Train to Pakistan"
3028,55,55,1,"‘Sat Sri Akal, Babuji,’ he said",,,Interpersonal,,FALSE,1457,Chundunnugger Police Station in Train to Pakistan,110,"Lal, Lala Ram in Train to Pakistan"
3029,55,57,2,Iqbal knew the expression,,,Interpersonal,,FALSE,1457,Chundunnugger Police Station in Train to Pakistan,1185|110|758|1468|120,"European memsahibs, Unknown in Train to Pakistan|Lal, Lala Ram in Train to Pakistan|Singh, Meet in Train to Pakistan|Subinspector, Unknown in Train to Pakistan|Chand, Hukum in Train to Pakistan"
3030,58,58,1,A little later the head constable arrived,,Religion,,,TRUE,1457,Chundunnugger Police Station in Train to Pakistan,129|1475|851|753|804,"Malli, Unknown in Train to Pakistan|Dacoits including Malli who later get arrested., Unknown in Train to Pakistan|Sultana Badmash, Unknown in Train to Pakistan|Unknown, Iqbal in Train to Pakistan|Baluchi and Pathan soldiers from Pakistan army, Unknown in Train to Pakistan"
3046,80,80,5,for a brief moment was overcome by temptation,,,,,,863,Lahore in Pinjar,,
3092,10,10,1,"Rashida picked her up and took her in his powerful arms. “Who will quench the fire in my heart?” he asked. Pooro tried to free herself, but could not get out of his embrace.",,Interpersonal,,,,334,Rashida's home in Pinjar,,
3093,10,10,2,After some days he bean to take her out for a few minutes before dawn and after twilight.,,,,,,334,Rashida's home in Pinjar,248|297,"Sahukars, Pooro in Pinjar|Shaikh, Rashida in Pinjar"
3094,11,11,1,By her own reckoning she had spent a full fortnight in the prison.,,,,,,334,Rashida's home in Pinjar,248|297,"Sahukars, Pooro in Pinjar|Shaikh, Rashida in Pinjar"
3095,11,11,2,"He told her bluntly, “Tomorrow you have to wear this; a Maulvi will be coming to perform our nikah. Be ready in time.”",,,,,,334,Rashida's home in Pinjar,248|297,"Sahukars, Pooro in Pinjar|Shaikh, Rashida in Pinjar"
3096,11,11,3,"Did you know that our families, the Shaikhs and the Sahukars have been at loggerheads for many generations?",,Interpersonal,,,,334,Rashida's home in Pinjar,3097|3100,"Sauhakar, Unkown (grandfather) in Pinjar|Shaikh, Unkown in Pinjar"
3171,25,25,1,I ran into the young Englishman again as I stepped out,,,,,TRUE,3174,Rawalpindi Train Station in A New Taj Mahal,,
3276,18,20,1,He slapped her thigh and said,,,,,,3306,Room in Colder Than Ice,3229|3201,"Kaur, Kalwant in Colder Than Ice|Singh, Ishwar in Colder Than Ice"
3314,20,20,2,Kalwant Kaur picked up Ishwar Singh’s kirpan,,,,,,3306,Room in Colder Than Ice,3201|3229,"Singh, Ishwar in Colder Than Ice|Kaur, Kalwant in Colder Than Ice"
3336,21,21,3,‘There was this house I broke into,,,,,,3335,House in Colder Than Ice,,
3352,21,21,4,I didn’t kill her ... I took her away,,,,,,3335,House in Colder Than Ice,3347,"Murdered Men, Unknown in Colder Than Ice"
3365,21,21,5,I carried her over my shoulder all the way to the canal,,,,,,3340,Canal in Colder Than Ice,,
3422,11,16,1,"Beginning with isolated incidents of stabbing, it had now developed into full-scale communal violence,",,,,,,3426,Amritsar in The Assignment,,
3428,11,11,2,Muslims living in Hindu localities began to leave for safer places,,,,,,3426,Amritsar in The Assignment,,
3429,11,12,3,"Sughra could not help noticing that, whenever she went on the roof, there were fires raging everywhere.",,,,,,3426,Amritsar in The Assignment,,
3430,13,13,1,Sughra in any case couldn’t because of her father’s deteriorating condition,,Class,,FALSE,FALSE,3426,Amritsar in The Assignment,3294,"Hai, Mian Abdul Hai, Mian Sahib, the judge in The Assignment"
3433,12,12,2,"However, when the power and water supplies were suddenly cut off",,,,,,3426,Amritsar in The Assignment,,
3435,12,12,3,Then one day Mian sahib suffered a stroke and was laid up in bed.,,,,,,3426,Amritsar in The Assignment,,
3436,13,13,2,"In the evening, when she took his food to him in his small room, he was not there",,Class,,FALSE,FALSE,3426,Amritsar in The Assignment,,
3437,12,12,4,All the shops in the area had been permanently boarded up.,,,,,,3426,Amritsar in The Assignment,,
3439,121,12,5,"The boy went, but came back almost immediately. His face was pale with fear.",,,,,,3426,Amritsar in The Assignment,,
3441,14,15,1,Suddenly there was a knock on the door.,,,Religion,TRUE,FALSE,3426,Amritsar in The Assignment,3313,"Singh, Gurmukh in The Assignment"
3446,15,15,2,"Then after a pause, ‘Sardarji is dead.’",,,Religion,TRUE,FALSE,3426,Amritsar in The Assignment,3313|3294,"Singh, Gurmukh in The Assignment|Hai, Mian Abdul Hai, Mian Sahib, the judge in The Assignment"
3456,16,16,1,"As Santokh Singh turned the corner, four men",,Religion,Religion,FALSE,FALSE,3426,Amritsar in The Assignment,,
3461,13,13,3,It was evening and the festival of Id was now only a day away.,,,Religion,FALSE,FALSE,3426,Amritsar in The Assignment,,
3480,22,22,22,"Only when a shot rang out, the birds got startled and took flight",,Nation,Nation,,,3471,Titwal in The Dog of Titwal,,
3481,22,22,22,"At two o’clock, he woke up Ganda Singh to  take over. Then he lay down, but sleep was as far away from his  eyes as the stars in the sky. He began to hum a Punjabi folk song",,Nation,Nation,,,3471,Titwal in The Dog of Titwal,,
3482,23,23,23,"This mood was shattered by the barking of a dog. Jamadar  Harnam Singh said, ‘Where has this son of a bitch materialized  from?’ The dog barked again.",,,,,,3471,Titwal in The Dog of Titwal,,
3483,23,23,23,Banta Singh got up to investigate and came back  with an ordinary mongrel in tow,,,,,,3471,Titwal in The Dog of Titwal,,
3484,23,23,23,"The dog went to Harnam Singh, who produced a cracker from  his kitbag and threw it on the ground. The dog sniffed at it and  was about to eat it, when Harnam Singh snatched it away",,,,,,3471,Titwal in The Dog of Titwal,,
3487,24,24,1,"The dog, who was about to munch his cracker, stopped dead  in his tracks, put his tail between his legs and looked scared.  Harnam Singh laughed",,,,,,3471,Titwal in The Dog of Titwal,,
3490,24,24,2,Jamadar Harnam Singh surveyed the area with his binoculars,,,,,,3471,Titwal in The Dog of Titwal,,
3491,24,24,3,"Subedar Himmat Khan scream,  ‘Where did you spend the night?’ But this was not addressed to Bashir. It was a dog he was  shouting at.",,,,,,3471,Titwal in The Dog of Titwal,,
3493,24,24,4,Subedar Himmat Khan threw a pebble at him,,,,,,3471,Titwal in The Dog of Titwal,,
3494,24,25,5,One of the soldiers grabbed the dog and undid his makeshift rope collar.,,,,,,3471,Titwal in The Dog of Titwal,,
3496,25,25,1,"Dutifully, Bashir read the whole thing again. ‘Jhun Jhun. This  is an Indian dog.’",,,,,,3471,Titwal in The Dog of Titwal,,
3497,25,25,2,"Subedar Himmat Khan picked up the wireless set and spoke to  his platoon commander, providing him with a detailed account of  the dog’s sudden appearance in their position, his equally sudden  disappearance the night before and his return that morning.  ‘What are you talking about?’ the platoon commander asked.",,,,,,3471,Titwal in The Dog of Titwal,,
3499,25,25,2,"Subedar Himmat Khan studied the map again. Then he tore  up a packet of cigarettes, cut a small piece from it and gave it  to Bashir. ‘Now write on it in Gurmukhi, the language of those  Sikhs.. .’ ‘What should I write?’ ‘Well . . .’ Bashir had an inspiration. ‘Shun Shun, yes, that’s right. We  counter Jhun Jhun with Shun Shun.’",,,,,,3471,Titwal in The Dog of Titwal,,
3501,25,25,3,He gave him something to eat,,,,,,3471,Titwal in The Dog of Titwal,,
3502,25,26,4,Subedar Himmat Khan turned him round to face the Indian position,,,,,,3471,Titwal in The Dog of Titwal,,
3505,26,26,1,The dog wagged his tail and moved down the winding hilly  track that led into the valley dividing the two hills. Subedar  Himmat Khan picked up his rifle and fired in the air,,,,,,3471,Titwal in The Dog of Titwal,,
3506,26,26,2,The two sides exchanged fire for half an hour,,,,,,3471,Titwal in The Dog of Titwal,,
3509,26,26,3,"Suddenly the soldier on lookout duty shouted, ‘There he  comes.’",,,,,,3471,Titwal in The Dog of Titwal,,
3511,26,26,4,"He picked up his rifle, aimed and fired. The bullet hit some  rocks close to where the dog was,",,,,,,3471,Titwal in The Dog of Titwal,,
3514,16,1,16,"As he bent over the furnace stuffed with hard coal,",,,,,,3520,"Village, Pakistan in Savage Harvest",,
3515,26,26,5,"It soon became a game between the two soldiers, with the dog  running round in circles in a state of great terror. Both Himmat  Khan and Harnam Singh were laughing boisterously.",,,,,,3471,Titwal in The Dog of Titwal,,
3516,27,27,1,"The dog turned. One of his legs was now quite useless. He  began to drag himself towards Harnam Singh, who picked up  his rifle, aimed carefully and shot him dead.",,,,,,3471,Titwal in The Dog of Titwal,,
3522,17,17,17,"Instead of the wheat, those who had planted it had been chopped up.",,Religion,,FALSE,TRUE,3520,"Village, Pakistan in Savage Harvest",3518,"Muslim Mob, Great Warriors in Savage Harvest"
3526,19,20,19,A soft knock on the front door shook Dina. He stood up in fright.,,,,,,3520,"Village, Pakistan in Savage Harvest",,
3527,16,17,2,Suddenly he dropped his tools and went,,,,,,3517,"Village, Pakistan in Savage Harvest",,
3529,18,19,1,Oh! Bashir’s mother!’ he shouted towards the house. ‘Give me,,Interpersonal,,,TRUE,3517,"Village, Pakistan in Savage Harvest",3486|3518,"Blacksmith, Bashir in Savage Harvest|Muslim Mob, Great Warriors in Savage Harvest"
3533,21,22,3,"At long last, Dina’s wife took courage",,Interpersonal,,,TRUE,3520,"Village, Pakistan in Savage Harvest",3500,"Brahmin Family, Brahmin's wife in Savage Harvest"
3534,20,21,1,"At long last, Dina’s wife took courage and said",,,Religion,,TRUE,3517,"Village, Pakistan in Savage Harvest",3495,"Brahmin family, Tulsi in Savage Harvest"
3535,21,21,21,"‘I’m telling you, he’s gone out of the village.",,,,,,3517,"Village, Pakistan in Savage Harvest",,
3537,22,22,2,"‘Come tomorrow,’ Dina shouted into the old woman’s ear.",,,,,,3517,"Village, Pakistan in Savage Harvest",3492,"Blacksmith, Bashir's mother in Savage Harvest"
3539,22,23,3,It was a rotten thing that Bashir had done.,,Religion,,,TRUE,3520,"Village, Pakistan in Savage Harvest",,
3540,23,23,2,"He was seized by a shiver, a cold and uncontrollable shiver that seemed a precursor to certain death. The shivering, he felt, could be stopped only if he picked up the red-hot iron from the fire and clasped it against his heart. But why was his head on fire? The entire blazing furnace seemed to have entered his head. He pressed his head with both hands and the fire came on to his palms. He was going mad. He would end up doing something terrible. He must run away, far away from all this. He opened the window and jumped out.",,Religion,,,TRUE,3517,"Village, Pakistan in Savage Harvest",,
3544,23,23,3,For a long time he wandered aimlessly in the fields,,Religion,,,TRUE,3520,"Village, Pakistan in Savage Harvest",,
3545,24,24,1,"He was seized by a shiver, a cold and uncontrollable shiver that seemed a precursor to certain death. The shivering, he felt, could be stopped only if he picked up the red-hot iron from the fire and clasped it against his heart. But why was his head on fire? The entire blazing furnace seemed to have entered his head. He pressed his head with both hands and the fire came on to his palms. He was going mad. He would end up doing something terrible. He must run away, far away from all this. He opened the window and jumped out.",,,,,TRUE,3517,"Village, Pakistan in Savage Harvest",,
